commit	Eval_AUC	status	description
fdbad98	0.7203	keep	baseline (30 trees depth 6 lr 0.1)
19e81e4	0.7321	keep	early stopping 10% val; depth 8 lr 0.05 (best_it 237)
f850823	0.7393	keep	subsample 0.8 colsample_bytree 0.8 (best_it 230)
7ee3a70	0.7419	keep	max_cat_threshold 16 (best_it 507)
9d74daa	0.7450	keep	max_cat_threshold 4 (best_it 894)
4622093	0.6646	discard	max_cat_threshold 1
ce3aca1	0.7147	discard	OOF row-hash-fold target encoding date x origin/dest/carrier (val 0.768 but eval drops)
cef442f	0.7201	discard	OOF TE with tables fit without val rows: honest val 0.727, best_it 14
478a01d	0.7525	keep	TE date x origin/dest/carrier on disjoint 50% split, model on other 50% (best_it 430)
3559916	0.7517	discard	add TE keys date x origin x 4h block, date x route
8f873dc	0.7609	keep	both halves: swap TE-table/model roles, average 2 models
429db26	0.7640	keep	K=3 parts: model fit on 2/3, TE tables from other 1/3, average 3 models
787e5b9	0.7626	discard	K=5 parts
17f0fcb	0.7633	discard	add TE key date (Month x DayofMonth)
ba70753	0.7649	keep	depth 10
9ef21d9	0.7649	discard	lr 0.03 (equal)
7412f25	0.7640	discard	TE smoothing 5
a2d6c7f	0.7647	discard	TE smoothing 50
2a15c7e	0.7663	keep	TE static pairs: route, carrier x origin, origin/dest/carrier x hour (eval 168s)
b078617	0.7663	keep	build TE keys once per prepare call (eval 168s -> 99s)
9289413	0.7670	keep	TE: carrier x route, route x hour, origin x weekday, month x origin (eval 131s)
df09b6b	0.7670	keep	faster prepare: plain-Python keys + dict lookups (eval 131s -> 39s)
10cc0b6	0.7683	keep	bag: 3-part split x 2 seeds = 6 models (train 54s!)
91b2486	0.7678	discard	early_stopping_rounds 50 (train 38s but -0.0005)
efbae97	0.0000	crash	prepare train once and slice per part (stratify bug)
09631d2	0.7683	keep	prepare train once + slice per part, stratify fix (train 54s -> 49s, same AUC)
2687476	0.7680	discard	colsample_bytree 0.6
9240ea5	0.7686	keep	drop raw Origin/Dest categoricals from models (train 49s -> 32s)
09a2c76	0.7691	keep	default max_cat_threshold (only low-card cats left)
334db8a	0.7695	discard	3 split seeds (9 models): +0.0004 but training 51s, too close to 60s limit
957a32a	0.7688	discard	TE key date x hour
19a3fee	0.7699	keep	TE lookups of previous/next day at same origin/dest
b0b9076	0.7701	discard	also +-2 days (+0.0002, +6s training; not worth it)
b08bad8	0.7699	discard	min_child_weight 5 (equal AUC, training 38s -> 31s)
1dcb4bc	0.7704	keep	min_child_weight 5 + 3 split seeds (9 models), train 47s
10999be	0.7704	discard	previous/next-day carrier rates (equal)
4f71d30	0.7685	discard	hierarchical smoothing of date keys toward day rate (+Date feature)
b26581c	0.7685	discard	drop raw Month/DayofMonth from models
68d7caa	0.7705	discard	reg_lambda 5 (+0.0001 noise, slower)
17237b2	0.7706	keep	max_bin 64 (slightly faster)
235052c	0.7704	discard	depth 12
74e3575	0.7706	discard	pooled 3-day window rates at origin/dest (equal)
818f530	0.7703	discard	early-stopping val 5%
e9cac85	0.7710	keep	TE key: scheduled flight (carrier+route+CRSDepTime)
30a45fa	0.7712	keep	TE key: carrier x origin x hour
8e76671	0.7707	discard	TE key: origin x weekday x hour
09a9b8e	0.7710	discard	vary depth 8/10/12 by split seed
fcdd061	0.7711	discard	numeric day-of-year feature
436a7c0	0.7712	discard	average in log-odds space (equal)
de9e083	0.7691	discard	predict with TE tables fit on all of train (distribution shift)
3c9a647	0.7716	keep	TE keys: origin, dest (single airports)
7fe0e0e	0.7716	discard	TE keys: month x dest, dest x weekday (equal)
10d6952	0.7716	keep	ablation: drop origin x weekday, month x origin (equal AUC, simpler, faster)
8c8b36b	0.7717	keep	ablation: drop carrier x hour, carrier x route (simpler, +0.0001)
ce5d18f	0.7715	discard	ablation: drop route x hour
afd645f	0.7717	discard	lr 0.07 + 4 split seeds (equal, slower)
5afbe11	0.7717	discard	TE smoothing 10 (equal)
06c50fb	0.7712	discard	subsample 0.7
9c4ab6d	0.7711	discard	ablation: drop dest x hour
772bb72	0.7716	discard	TE key: date x origin x carrier
